{
  "project": "my-web-app",
  "version": "1.0.0",
  "created_at": "",
  "features": [
    {
      "id": "F001",
      "category": "setup",
      "title": "项目基础结构搭建",
      "description": "初始化项目结构，配置构建工具、代码规范工具",
      "priority": 1,
      "steps": [
        "初始化包管理器和项目配置",
        "创建源码目录结构",
        "配置构建工具",
        "配置代码规范工具"
      ],
      "test_criteria": [
        "项目可以成功安装依赖",
        "构建命令可以正常执行",
        "代码规范检查命令可以运行"
      ],
      "passes": false,
      "dependencies": [],
      "notes": ""
    },
    {
      "id": "F002",
      "category": "setup",
      "title": "开发服务器配置",
      "description": "配置开发服务器，支持热重载",
      "priority": 1,
      "steps": [
        "配置开发服务器",
        "验证热重载功能",
        "更新 init-dev.sh 启动脚本"
      ],
      "test_criteria": [
        "开发服务器可以正常启动",
        "访问 localhost 返回页面",
        "修改代码后页面自动刷新"
      ],
      "passes": false,
      "dependencies": ["F001"],
      "notes": ""
    },
    {
      "id": "F003",
      "category": "ui",
      "title": "基础页面布局",
      "description": "创建应用的基础布局结构",
      "priority": 2,
      "steps": [
        "创建主布局组件（header/main/footer）",
        "实现响应式布局",
        "添加基础样式"
      ],
      "test_criteria": [
        "页面在桌面和移动端正确显示",
        "布局结构包含 header、main、footer",
        "页面无样式错乱"
      ],
      "passes": false,
      "dependencies": ["F002"],
      "notes": ""
    }
  ]
}
